{
  "conflict_id": "CONFLICT-0001",
  "incident_id": "NEPAL-RASUWA-2026",
  "person_ids": ["PERSON-0001", "PERSON-0002"],
  "record_ids": ["RR-0001", "RR-0002", "RR-0003"],
  "conflict_type": "SPLIT_IDENTITY_ATTRIBUTES",
  "description": "Family appeal combines Suman Tamang + Hetauda-6 + Chowghada. Official records split strongest attributes between an exact-name candidate and an exact-locality candidate.",
  "severity": "HIGH",
  "status": "OPEN",
  "resolution": null
}
